{
  "event_type": "vision.inspection-observation",
  "schema_version": 1,
  "observation_id": "9e4a2c1b-7d6f-4e58-b3a2-6c5d4e3f2a19",
  "inspection_request_id": "IR-2026-0001",
  "inspection_run_id": "IRUN-2026-0001-c",
  "subject": {
    "lot_id": "L-REENTRANT-2",
    "lot_revision": "lot-r6",
    "serialized_component_id": "C-REENTRANT-1",
    "serialized_component_revision": "component-r7",
    "route_visit_id": "V-10"
  },
  "context": {
    "world_id": "world-dev-001",
    "simulation_run_id": "run-0007",
    "branch_id": null
  },
  "source_artifact": {
    "ref_schema": "cap.artifact-ref/v1",
    "artifact_id": "3f2b6c1e-8d4a-4e7b-9a21-5c0d7e9f1a42",
    "version": 1,
    "artifact_type": "inspection_image",
    "checksum": {
      "algorithm": "sha256",
      "value": "b94d27b9934d3e08a52e52d7da7dabfac484efe37a5380ee9088f7ace2efcde9"
    }
  },
  "outcome": "NOT_EVALUATED",
  "review_required": true,
  "data_quality": {
    "status": "INVALID_INPUT",
    "flags": [
      "UNDECODABLE_IMAGE"
    ]
  },
  "defects": [],
  "image_anomaly_score": null,
  "confidence_calibration": "UNCALIBRATED",
  "pipeline_identity": {
    "models": [
      {
        "task": "BASELINE_ALGORITHM",
        "model_package_id": "vision-baseline-generic",
        "model_version": "0.1.0"
      }
    ],
    "preprocessing_version": "prep-gray-norm-1",
    "threshold_policy_version": "tp-dev-1",
    "output_schema_version": "vision.inspection-observation.v1"
  },
  "inference": {
    "started_at": "2026-10-25T09:00:01Z",
    "completed_at": "2026-10-25T09:00:01.012Z",
    "latency_ms": 12
  }
}
